links,title,time,content,class
https://nltimes.nl/2023/01/04/70th-anniversary-north-sea-flood-killed-1836-netherlands-approaching,"70th Anniversary of North Sea flood that killed 1,836 in the Netherlands approaching",4 January 2023 - 15:44,"February 1 will mark 70 years since the dikes along the Zeeland and Zuid-Holland islands broke during the spring tide combined with a severe southwesterly storm. A disastrous flood resulted, in which 1,836 people died mainly in Zeeland, Zuid-Holland and Noord-Brabant, but also in Noord-Holland.The disaster of 1953 will be commemorated in the coming period in each of the provinces involved. Approximately 150,000 hectares of land disappeared under water, and tens of thousands of homes were destroyed. Public broadcaster NTR will air episodes from a documentary series on each of the following four Fridays, starting on January 6. The series is called Het water komt, or The Water Comes, and will be presented by Winfried Baijens who is originally from Zeeland.The four-part documentary includes archival footage and eyewitness accounts. The broadcasts will explain how the disaster happened in the first place, why the danger was insufficiently recognized in advance and what has been learned in the decades since the flood disaster. NTR has also produced seven podcasts from cities that also once had to deal with flooding, such as Nijmegen, Marken, Valkenburg and Zwolle.Herman van der Zandt will present five daily short broadcasts on NOS after the 8 p.m. news starting on January 30. He will take viewers back to 1953, the NOS said. His episodes will examine what happened, how the Netherlands learned about it, and the organization of relief efforts amid the devastation. Van der Zandt will be assisted by reporter Martijn Bink and experts.On February 1, Princess Beatrix, will attend the commemoration in Oude-Tonge on Goeree-Overflakkee where 305 people died. Beatrix's mother, Juliana, was five years into her reign as Queen of the Netherlands when the tragedy happened. Beatrix will visit the church service and a wreath-laying, and will then speak with survivors of the disaster and their relatives.The commemoration will be broadcast live on NOS, but the broadcaster's presenters will provide coverage from Schouwen-Duiveland in Ouwerkerk at the Watersnoodmuseum, the national flood museum, and the country's national monument dedicated to the flood, where a large ceremony will be held.The last deep breach in the sea dike was closed in Ouwerkerk. This year, a QR code will be placed at all 96 of the breaches in Zeeland and Zuid-Holland so tourists can read exactly what happened at that location on the night of the disaster between late on January 31 and early on February 1.Almost all villages and municipalities involved in the flood disaster also hold their own commemoration on February 1. The Watersnoodmuseum will open an exhibition linking objects from that time to people. Schools can also receive education material, and lectures and symposiums will be published throughout the year.""The future of water is also explicitly discussed. Because how the Netherlands deals with water is more topical than ever,"" said Watersnoodmuseum director Siemco Louwerse.",1-1-2CultureArt
https://nltimes.nl/2023/01/04/video-wind-turbine-topples-collapses-zeewolde,Video: Wind turbine topples over and collapses in Zeewolde,4 January 2023 - 12:55,"Strong wind likely caused a wind energy turbine to break apart and crash to the ground in Zeewolde, Flevoland local safety officials said. The incident happened along the Eemmerdijk on Wednesday morning when a warning was in effect for strong sustained winds and gusts in neighboring regions.Brandweer aanwezig bij geknakte  windmolen aan de Nekkeveldweg. pic.twitter.com/05PyCAd1pK“Nobody was injured in the incident,” firefighters said on social media. “Debris is lying in the field and along the Eemmerdijk.”The shaft snapped, and the top of the windmill came crashing down, including the rotor, a spokesperson told ANP. The debris was scattered over an area of several hundred meters. Firefighters said traffic was being allowed to continue through the area, though AD said a bike path was blocked.The newspaper said parts landed on the verge of the road and against the dike. According to ANP, the roadway was restricted to local traffic at times.The wind turbine is about 20 years old, reported AD. The other windmills along the dike will also be inspected as a result of the accident.Our technical crew is “on their way and will soon investigate the exact cause. We are now discussing how to get rid of the mill. At the moment the wind is too strong to do that in a safe way,” said Geertjan Veenstra of the Flevoland Security Region to AD.",1-1-2
https://nltimes.nl/2023/01/04/noted-psychiatrist-reportedly-dies-klm-flight-paramaribo-amsterdam,Noted psychiatrist reportedly dies during KLM flight from Paramaribo to Amsterdam,4 January 2023 - 12:20,"A passenger on a KLM aircraft that departed from Paramaribo, Suriname died midway through the flight. The deceased was identified as psychiatrist Rudi Dwarkasing by media outlets including Waterkant and Dagblad Suriname.Dwarkasing was the medical director of the Suriname Psychiatric Center, and was specialized in treating elderly patients. He reportedly suffered a heart attack during the flight.KLM flight number 714 departed Johan Adolf Pengel International Airport at about 5:15 p.m. local time on Tuesday, and made an unscheduled landing about eight hours later in Shannon, Ireland at 4:22 a.m. ""The passenger became seriously ill on board and unfortunately died afterwards,"" said an airline spokesperson to newswire ANP. His body was removed from the Boeing 777-300ER in Ireland and was transported to a mortuary.The airline did not confirm details about the passenger’s identity due to privacy regulations. The Ministry of Public Health in Suriname was also waiting for more details and did not release a statement.Airport records show KLM flight 714 departed Shannon at 6:30 a.m. local time. It landed in Amsterdam at 8:09 a.m., about 2 hours and 40 minutes later than scheduled.",1-1-2Business
https://nltimes.nl/2023/01/04/450-major-train-disruptions-2022-says-prorail,"About 450 major train disruptions in 2022, says ProRail",4 January 2023 - 11:20,"Last year there were about 450 major disruptions on the Dutch railroad system. These were largely caused by collisions, signal failures, switch failures, stormy weather, computer failures and broken catenary systems, a spokesperson for ProRail confirmed after initial reporting by the Telegraaf.The number of failures was therefore higher than in 2021. That year, there were 406 major failures. In 2020 there were 361 significant incidents.Those two years were also affected by a reduced timetable. This was to compensate for lower passenger totals during coronavirus restrictions.Last year, there were eighteen days on which more than 10 percent of all rail journeys were cancelled. National rail traffic was fully suspended on two different days.John Voppen, CEO of ProRail, is not satisfied by the figures. He told the Telegraaf, ""With a first look at the performance of 2022 and the causes of setbacks, I say there is work to be done for the rail sector. Let's invest in our people and resources to improve performance.""",PoliticsBusiness
https://nltimes.nl/2023/01/04/dutch-population-grew-twice-fast-2022-2021-entirely-due-immigration,"Dutch population grew twice as fast in 2022 as 2021, entirely due to immigration",4 January 2023 - 10:30,"The Dutch population grew almost twice as fast in 2022 as a year earlier, Statistics Netherlands (CBS) reports based on figures up to December 1 and an estimate from the last month. There was an increase of 227,000 inhabitants, compared to 115,000 in 2021, according to the statistics office. With this growth, the number of inhabitants in the Netherlands stands at 17.8 million.In 2022, about 168,000 children were born, a reduction of over 11,000 from 2021 figures. About 169,000 people died last year. As a result, birth and death rates have remained about the same, so that population growth can be fully attributed to foreign immigration.A relatively high number of immigrants were registered last year, when about 402,000 people moved to the Netherlands. That is 150,000 more than in 2021. In every municipality the number of immigrants was higher than the number of emigrants.The larger cities in the Netherlands grew the fastest. Eindhoven and Almere had the strongest growth with 22 new people per thousand inhabitants. Of the major cities, only Rotterdam and Breda were slightly below the national average. The data does show that more people emigrated out of the Netherlands than moved to the Netherlands in the major cities, especially in the Randstad, but also Groningen and Eindhoven.Seven municipalities showed a per capita increase above 30 new inhabitants per thousand, where the national average was 13 per thousand. The seven municipalities include the Noordoostpolder, Waddinxveen, Diemen, Maassluis, Woudenberg and the islands of Vlieland and Schiermonnikoog.The number of inhabitants decreased in only nine of the 344 municipalities, which is less than in previous years. In 2020, the population fell in 61 municipalities. These municipalities were mainly located at the perimeter of the Netherlands, such as the coastal areas, or at the borders with Belgium and Germany.About 100,000 of the immigrants arrived from Ukraine after the Russian invasion in February. Some 89,000 of them have registered with a Dutch municipality since February. Many Ukrainians have also left the Netherlands, mainly back to Ukraine.After Ukraine, the most immigrants who settled in the Netherlands arrived from Syria, followed by Turkey, India and Poland.Without immigration, many municipalities would have experienced a contraction: 62 percent of them had a mortality rate that was higher than the birth rate. That figure was 53 percent in 2021, and the number has risen sharply in twenty years. In 2002, just 13 municipalities reported a death rate that outpaced new births.Since then, the number of municipalities has also decreased, because many municipalities have merged. The municipalities where more babies are born than people die are mainly in Flevoland, the Randstad region, and in and around Zwolle.Flevoland is the province where the population is growing the fastest, followed by Noord-Holland, Zuid-Holland and Utrecht. The growth in Flevoland was 22 new people per thousand inhabitants. In Noord-Holland it was sixteen per thousand inhabitants and in Zuid-Holland and Utrecht it was thirteen per thousand inhabitants. In Flevoland, the population grew because more people were born than died, because of domestic relocations, and also foreign immigration. In both Noord- and Zuid-Holland, on the other hand, there were more people who moved away from these provinces to other parts of the Netherlands.The difference between Zuid-Holland and Utrecht and the other provinces is not significant. Zeeland was at twelve new people per thousand inhabitants, Gelderland, Overijssel and Groningen at eleven, Limburg, Friesland and Drenthe closed the list with nine new residents per thousand inhabitants.",Politics
https://nltimes.nl/2023/01/04/cities-will-soon-monitor-sex-work-coercion-privacy-concerns-remain,"Cities will soon monitor sex work for coercion, but privacy concerns remain",4 January 2023 - 10:01,"Municipalities in the Netherlands will soon be required to register people who are participating in sex work to determine if they are doing so voluntarily, and if they meet minimum age and language ability requirements. The measure is meant to guarantee that people earning money from legal sex work have not been coerced, and are protected from abuse, said newspaper AD in a report on Wednesday.It is not yet clear when the new measure will take effect. It will also give the cities the right to review company records from sex work operators, and to read the intake interviews of anyone working for them. Cities will also be able to randomly review the age of those workers, and to check that sex workers and the firms where they work are able to understand each other whether in Dutch, English, or another common language.André van Dorst is critical of the plan. He heads up an association of businesses that work in the industry, known as the Vereniging Exploitanten Relaxbedrijven. The victims of human trafficking are far more likely to be found in illegal sex businesses, and not properly licensed and registered companies acting out in the open. He said those forced into prostitution are trafficked on apps and websites.Further, The new rules will require both the operator and the city to maintain and process personal data. The data can be kept for up to five years.“It is not at all good for municipalities to register who is playing the role of the whore,” Van Dorst told the newspaper. It is “a useless solution, to the disadvantage of prostitutes who lose an important piece of privacy.” The measure is only meant as a show piece for municipalities to say they have their house in order.However, Ina Hut disagrees, saying that the limitation on the length of time that data is kept does continue their right to privacy. Hut is the director of CoMensha, an organization monitoring developments in human trafficking.“Unfortunately there is still forced prostitution, sometimes also by minors,” Hut said. “This change can also protect sex workers who do work voluntarily.''",HealthPoliticsCultureLifestyle
