links,title,time,content,class
https://nltimes.nl/2022/12/22/netherlands-extradites-el-chapo-asia-australia,The Netherlands extradites “El Chapo of Asia” to Australia,22 December 2022 - 10:15,"The Netherlands has extradited a 59-year-old Canadian man known as Asia’s El Chapo to Australia. The Chi Lop was apprehended nearly two years ago at Schiphol Airport while on a stopover as he made his way from Taiwan to Canada.Australian police accuse Tse of leading a the Sam Gor syndicate, also known as The Company. The organization was said to be responsible for 70 percent of drugs entering Australia mainly through the sale of crystal meth, other methamphetamine, and heroin, according to local media.“The AFP will allege the man was part of a conspiracy to traffic separate quantities of methamphetamine, (or derivatives of the drug), totaling 20kg, between March 2012 and March 2013. It is alleged the seized drugs have a street value of up to $4.4 million dollars in today’s prices,” the AFP said in a statement. That converts to approximately 2.79 million euros.Dutch police said Tse’s arrest went “quietly” when he was taken into custody at Schiphol on 22 January 2021. His arrest was on behalf of the AFP who had submitted an Interpol Red Notice request for his detention.His bid to fight extradition failed in the Dutch court system. ""Mass media calls me the king of a drug cartel, but that's not right. I'm afraid that if I go to Australia and there is a court case, the judge will see me through tinted lenses and treat me unfairly,” he told a Rotterdam court last year, according to ANP. “Media spread rumors that are not the truth, that's why I'm very scared.""He was expected to appear in court in Melbourne on Thursday to face commercial drug trafficking charges. “The maximum penalty for this offence is life imprisonment,” the Australian Federal Police (AFP) said in a statement.Sam Gor leaders allegedly conspired with people lower in the organization to transport drugs across Australia, and launder money in that country and abroad, sometimes using a bank account in the name of an Australian casino.",Crime
https://nltimes.nl/2022/12/22/early-christmas-traffic-will-crowd-roads-airports-tonight-train-problems-likely,Early Christmas traffic will crowd the roads & airports tonight; Some train problems likely,22 December 2022 - 09:44,"A difficult evening rush hour commute was predicted for Thursday as people flee their offices to get a head start on the Christmas holiday. A busy day was also expected at Schiphol Airport, and people traveling internationally by train may face some trouble due to labor strikes.Dutch infrastructure agency Rijkswaterstaat warned that people using the roads on Thursday need to take into account extra traffic, even outside of rush hour. People can expect the heaviest volumes of traffic around 5:30 p.m. on a particularly busy day, particularly as many schools have also given children the day off on Friday.“Many people are on holiday because of the holidays and it is expected that some will go out to celebrate these days at a holiday destination in the Netherlands or abroad,” Rijkswaterstaat said. The possibility of rainy weather and reduced visibility will prompt motorists to be more cautious and keep their distance, which can lead to longer traffic jams.The worst traffic is expected on the A2 and A27 leading from Utrecht into the south of the Netherlands, said the Dutch motor club ANWB. The roads headed east towards the German border will also likely be crowded.In the Netherlands, traffic is also expected to build quickly and early on Friday afternoon, but to a lesser extent than on Thursday. “Abroad, around the start of the Christmas holidays, it will be especially busy on the routes to the winter sports areas,” said the ANWB.Those traveling out of Schiphol Airport on Thursday can also expect a busy day, the airport said. ""We expect long queues for your departure from Schiphol. Some possibly starting outside the terminal,"" which is partially covered.Eindhoven Airport has continuously warned its passengers about crowds trying to access their departure halls. The country’s second largest airport advised people to show up at least 2.5 hours ahead of departure.Additionally, those trying to escape the Netherlands by train may run into some problems when visiting France or England. Although train worker strikes in France will not impact the Thalys and Eurostar timetables, those traveling within France will face problems. This is especially true for passengers using the TGV-INTERCITES lines.The SNCF rail strike in France will start at 8 p.m. on Thursday and continue until 8 a.m. on Boxing Day. Anyone who booked their ticket with NS International can change or cancel their trip without paying a penalty if their train has been cancelled, or if the expected delay tops one hour.A strike will also impact service in the United Kingdom starting on Friday, which should also last through Boxing Day. Eurostar has released a modified timetable as they will have more limitations on staffing and railway network availability.Additionally, the Highspeed line in the UK will be closed on Monday. Passengers can change their itineraries or cancel them altogether without fee using the company that booked the ticket.Those wanting to modify their route will have to cancel their ticket and book a new ticket at the current price, according to the NS.",BusinessCultureLifestyle
https://nltimes.nl/2022/12/22/irene-schouten-max-verstappen-crowned-top-dutch-athletes-amsterdam,"Irene Schouten, Max Verstappen crowned top Dutch athletes in Amsterdam",22 December 2022 - 09:05,"Speed skater Irene Schouten was chosen as Sportswoman of the Year, and Formula 1 driver Max Verstappen was named Sportsman of the Year at the national annual Sports Gala held in Amsterdam on Wednesday evening.Short track trainer Jeroen Otter also won top honors as the country’s best coach. Former Dutch women’s national football trainer Sarina Wiegman was awarded best coach by the BBC for her work with England’s national football team.Irene Schouten, the 30-year-old skater from Noord-Holland, was the undisputed queen of the Beijing Winter Olympics last winter. She took home three gold medals and a bronze medal.She received the most votes from her fellow top athletes and the professional jury taking part in the ceremony, and received the accompanying Jaap Eden Award. Former professional footballer Ruud Gullit presented the award during the gala in AFAS Live.Schouten succeeds athlete Sifan Hassan, who was not nominated this year. Two-time Olympic short track champion Suzanne Schulting and cycling world champion Annemiek van Vleuten were the other two nominees.Schouten was practically unbeatable last skating season and showed her dominance in the long distances in Beijing with gold in the 3,000 meters, 5,000 meters and mass start. Her bronze came in the team pursuit. She became the most successful Dutch athlete ever at a single Winter Games with her presence on the podium. A month after the Games, to her own surprise, she also won the world all-round title.The professional jury had difficulty choosing three nominees this year. There was no unanimous decision. For example, three-time European athletics champion Femke Bol and skater Ireen Wüst, the most successful Dutch Olympian ever, dropped out.""This means a lot, because what those other athletes have achieved is also not normal,"" said Schouten. Ninety percent of the people around me thought I should do things differently, but I believed in it.""Race car driver Max Verstappen has been chosen as Sportsman of the Year for the third time. The 25-year-old Limburger won the world title in Formula 1 this year for the second straight season. He received the most votes in the election from his fellow athletes and the professional jury.The Red Bull Racing driver won the election against two other nominated athletes, multiple track cycling world champion Harrie Lavreysen and Olympic speed skating champion Thomas Krol.Verstappen himself was not present at the Sports Gala. His younger sister Victoria was in Amsterdam to represent him, and accepted the accompanying Jaap Eden Award on his behalf. It was presented by skating icon Ireen Wüst.Verstappen was previously Sportsman of the Year in 2016 and 2021. In 2016 he was the first Dutch winner of a Formula 1 race, and was also the youngest ever F1 driver to win a race. Last year he received the honorary title for accomplishing his first world title in the premier class of motorsport.This year he extended his title with a record fifteen grand prix victories. In addition, together with his Mexican teammate Sergio Pérez, he gave the Red Bull racing team the Constructors' Championship.After the ceremony, a video followed in which numerous drivers and former drivers from Formula 1 congratulated Verstappen, including Jackie Stewart, Nelson Piquet, Mark Webber, Nico Hülkenberg and Damon Hill.Short track trainer Jeroen Otter was chosen as Coach of the Year at the Sports Gala. He celebrated successes with the women who took part at the Winter Games in Beijing, including gold for Suzanne Schulting in the 1,000 meters and gold for the relay team in the 3,000 meters relay.After the Beijing Games, Otter decided to take a sabbatical. He has been employed by the skating association since 2010 and under his leadership the Netherlands has become one of the leading countries in short track speed skating. Otter called the relay team's gold his ""most beautiful title"" at the Games.The 58-year-old Otter had been nominated before, but now saw his years of dedication to Dutch short track rewarded with the top Coach Award. He received the most votes from his fellow coaches and the professional jury and won the election of the two other nominees: national rowing coach Eelco Meenhorst and football coach Sarina Wiegman.However, Sarina Wiegman was named coach of the year during the BBC Sports Personality of the Year held in England. The former Oranje national coach won the European Championship in women's football with England this year.""I feel honored, but also appropriately humbled,” she said to the BBC after winning the award. ""I never could have accomplished this without an amazing group of players. And we had a great staff. It was awesome. I’m lucky to work with these players.""Wiegman also won the European Championship one time as coach of the Dutch women’s football team.",Sports
https://nltimes.nl/2022/12/22/people-netherlands-giving-faith-58-religious,More people in the Netherlands giving up on faith: 58% are not religious,22 December 2022 - 08:29,"Residents of the Netherlands are continuing to abandon religion, according to research from Statistics Netherlands (CBS) that looked at the beliefs of people aged 15 and up. Non-religious people first emerged as the majority of the population in 2017, and since then they have continued to make up a larger proportion of society. Fewer than 13 percent of people said they regularly attend religious services.“In 2021, 58 percent of the Dutch population aged 15 or older did not consider themselves to belong to a religious denomination or philosophical group,” the CBS said on Thursday. “A year earlier that was 55 percent, and in 2010 it was still 45 percent.”The sharpest fall was observed among Roman Catholics. Some 27 percent identified as part of that religion in 2010, falling to 19.8 percent in 2020, and 18.3 percent in 2021. Although the proportion of Catholics has dropped significantly, it still represented the largest single religious group in the Netherlands.The percentage of people calling themself Protestant fell from 18.0 percent down to 13.6 percent in 2021. During that time, the popularity of Islam also fell from 5.0 percent to 4.6 percent.On the other hand, the collective group of “other denominations” showed an increase. Over the last decade, this figure fluctuated from a low point of 5.0 percent from 2010-2011, to a high point of 6.5 percent in 2012 and 2015. In 2021, some 6.1 percent of residents said they identified with a different religion or philosophical group than Catholic, Protestant or Islam.The largest proportion of atheists and non-religious people was found in the 18-25 year age range, with 72.4 percent identifying as such. That figure steadily declines as older segments of the population are analyzed, as they fall into the minority with the population 65 and older.People quickly identified as not being religious once they reached the age of 18. About 58.8 percent of those between 15-18 years of age said they were not religious.",CultureLifestyle
https://nltimes.nl/2022/12/22/sharpest-monthly-drop-dutch-housing-prices-since-2013,Sharpest monthly drop in Dutch housing prices since 2013,22 December 2022 - 07:32,"Average home sales prices in the Netherlands fell for the fourth month in the row, with November representing the sharpest recorded decrease since May 2013. Owner occupied homes sold in November cost nearly 1 percent less on average than in October, according to data released on Thursday by Statistics Netherlands (CBS).After years of sharp, dramatic increases in housing prices, a peak was reached in July. The average sales price began to fall because of a combination of factors, mainly the rising mortgage interest rates. That makes it harder for buyers to put together the financing needed to purchase more expensive properties.Overall, the Dutch Central Bank predicted that home prices will fall by about 3 percent in 2023 and 3 percent in 2024. That exceeds predictions from ABN Amro and ING, which both predicted a 2.5 percent fall in 2023.Despite the decrease in November, homes still sold for prices that were 4.9 percent higher than 12 months earlier. That reflected the lowest year-on-year increase in over six years, the CBS said. The year-on-year increase recently peaked at over 21 percent at the start of 2022.After the economic crisis, home sales prices hit a low point in June 2013. Since then, prices have jumped by nearly 95 percent.Additionally, the number of residential real estate transactions have been falling. The Dutch real estate registry, Kadaster, was informed of 15,146 housing transactions in November. That was about 6 percent fewer than a year earlier.“In the first 11 months of 2022, 171,767 homes were sold, down more than 1.6 percent than in the same period of 2021,” the CBS said.",Business
